Course Dept,Course #,Course Name,Prerequisites,Units,Tools,Description,Course Cluster
Civil and Environmental Engineering (CIV ENG),193,Engineering Risk Analysis,Upper division standing,3,nan,"Applications of probability theory and statistics in planning, analysis, and design of civil engineering systems. Development of probabilistic models for risk and reliability evaluation. Occurrence models; extreme value distributions. Analysis of uncertainties. Introduction to Bayesian statistical decision theory and its application in engineering decision-making.",Engineering
Electrical Engineering (EL ENG),144,"Fundamental Algorithms for Systems Modeling, Analysis, and Optimization","EE20, CS 70",4,"R, Python","The modeling, analysis, and optimization of complex systems requires a range of algorithms and design software. This course reviews the fundamental techniques underlying the design methodology for complex systems, using integrated circuit design as example. Topics include design flows, discrete and continuous models and algorithms, and strategies for implementing algorithms efficiently and correctly in software. Laboratory assignments and a class project will expose students to state-of-the-art tools.",Engineering
Electrical Engineering (EL ENG),129,Neural and Nonlinear Information Processing,EE 120 or consent of instructor,3,nan,"Principles of massively parallel real-time computation, optimization, and information processing via nonlinear dynamics and analog VLSI neural networks, applications selected from image processing, pattern recognition, feature extraction, motion detection, data compression, secure communication, bionic eye, auto waves, and Turing patterns.",Engineering
Electrical Engineering (EL ENG),127,Optimization Models in Engineering,MATH 54 or consent of instructor,4,nan,"This course offers an introduction to optimization models and their applications, ranging from machine learning and statistics to decision-making and control, with emphasis on numerically tractable problems, such as linear or constrained least-squares optimization.",Engineering
Electrical Engineering (EL ENG),126,Probability and Random Processes,"EE 16A, EE 16B",4,nan,"This course covers the fundamentals of probability and random processes useful in fields such as networks, communication, signal processing, and control. Sample space, events, probability law. Conditional probability. Independence. Random variables. Distribution, density functions. Random vectors. Law of large numbers. Central limit theorem. Estimation and detection. Markov chains.",Engineering
Engineering (ENGIN),180A,Computational Engineering Science Modeling and Simulation I/II,"E 7, MATH 128A - MATH 128B, MATH 170A - MATH 170B, Upper division standing",4,nan,"This course sequence focuses on the concepts of computational modeling and simulation. Concepts are illustrated with projects drawn from the multidisciplinary areas of computational engineering science. Areas covered span biology, chemistry, applied mathematics, and physics, as well as all areas of engineering. Models will progress sequentially through problem statement, mathematical model, approximations and analytic solution, discrete model, object-oriented model, implementation and simulation, visualization, and comparison to analysis, experimentation and observation.",Engineering
Engineering (ENGIN),7,Introduction to Computer Programming for Scientists and Engineers,MATH 1B,4,nan,"Elements of procedural and object-oriented programming. Induction, iteration, and recursion. Real functions and floating-point computations for engineering analysis. Introduction to data structures. Representative examples are drawn from mathematics, science, and engineering. The course uses the MATLAB programming language. Sponsoring departments: Civil and Environmental Engineering and Mechanical Engineering.",Engineering
Engineering (ENGIN),170,Introduction to Modeling and Simulation,"E 7, MATH 53, MATH 54, Upper division standing",4,R,"Introduces concepts of computational modeling and simulation, using multidisciplinary projects drawn from biology, chemistry, applied mathematics, and physics, and all areas of engineering. Models progress sequentially through problem statement, mathematical model, approximations and analytic solution, discrete model, object-oriented model, implementation and simulation, visualization, comparison to analysis, experiment and observation. Includes a broad survey of simulation techniques.",Engineering
Engineering (ENGIN),117,Methods of Engineering Analysis,"MATH 53, MATH 54",3,Python,Methods of theoretical engineering analysis; techniques for analyzing partial differential equations and the use of special functions related to engineering systems. Sponsoring Department: Mechanical Engineering.,Engineering
Engineering (ENGIN),120,Principles of Engineering Economics,Upper division standing,3,nan,"Economic analysis for engineering decision making: Capital flows, effect of time and interest rate. Different methods of evaluation of alternatives. Minimum-cost life and replacement analysis. Depreciation and taxes. Uncertainty; preference under risk; decision analysis. Capital sources and their effects. Economic studies.",Engineering
Industrial Engineering and Operations Research (IND ENG),115,Databases,None,3,"MS Access, SQL","Design and implementation of databases, with an emphasis on industrial and commercial applications. Relational algebra, SQL, normalization. Students work in teams with local companies on a database design project. WWW design and queries.",Engineering
Industrial Engineering and Operations Research (IND ENG),131,Discrete Event Simulation,"IEOR 161, IEOR 165, IEOR 172 or STAT 134.",3,nan,"Free communication has changed the world, including the expectations and work and play. The class begins with the two data revolutions--the first about passively collected clicks on the web, the second about actively contributed data, as platforms like Facebook empower individuals to contribute a variety of quantitative and qualitative data (transactions, social relations, attention gestures, intention, location, and more.) With active student participation, we explore the far-reaching implications of the consumer data revolution for individuals, communities, business, and society.",Engineering
Industrial Engineering and Operations Research (IND ENG),165,"Engineering Statistics, Quality Control, Forecasting",IEOR 172 or STAT 134,3,"R, Python, or MATLAB","This course will introduce students to basic statistical techniques such as parameter estimation, hypothesis testing, regression analysis, analysis of variance. Specific applications in forecasting and quality control will be considered in detail.",Engineering
Industrial Engineering and Operations Research (IND ENG),162,Linear Programming and Network Flows,"MATH 53, MATH 54",3,nan,"This course addresses modeling and algorithms for optimization of linear constrained optimization problems. The simplex method; theorems of duality; complementary slackness. Applications in production planning and resource allocation. Graph and network problems as linear programs with integer solutions. Algorithms for selected network flow problems. Transportation and logistics problems. Dynamic programming and its role in applications to shortest paths, project management and equipment replacement.",Engineering
Industrial Engineering and Operations Research (IND ENG),130,Methods of Manufacturing Improvement,"IEOR 172 or STAT 134, MATH 54",3,nan,"Analytical techniques for the improvement of manufacturing performance along the dimensions of productivity, quality, customer service, and throughput. Techniques for yield analysis, process control, inspection sampling, equipment efficiency analysis, cycle time reduction, and on-time delivery improvement. Applications on semiconductor manufacturing or other industrial settings.",Engineering
Industrial Engineering and Operations Research (IND ENG),172,Probability and Risk Analysis for Engineers,MATH 1A - MATH 1B or MATH 16A - MATH 16B,3,nan,"This course will introduce students to basic statistical techniques such as parameter estimation, hypothesis testing, regression analysis, analysis of variance. Specific applications in forecasting and quality control will be considered in detail.",Engineering
Mechanical Engineering (MEC ENG),120,Computational Biomechanics Across Multiple Scales,ME C85,3,nan,This course applies the methods of computational modeling and continuum mechanics to biomedical phenomena spanning various length scales ranging from molecular to cellular to tissue and organ levels. The course is intended for upper level undergraduate students who have been exposed to undergraduate continuum mechanics (statics and strength of materials.),Engineering
Mechanical Engineering (MEC ENG),C180,Engineering Analysis Using the Finite Element Method,"E 7 or CS 61A, MATH 53, MATH 54, Upper division standing",3,nan,"This is an introductory course on the finite element method and is intended for seniors in engineering and applied science disciplines. The course covers the basic topics of finite element technology, including domain discretization, polynomial interpolation, application of boundary conditions, assembly of global arrays, and solution of the resulting algebraic systems. Finite element formulations for several important field equations are introduced using both direct and integral approaches. Particular emphasis is placed on computer simulation and analysis of realistic engineering problems from solid and fluid mechanics, heat transfer, and electromagnetism. ",Engineering
Mechanical Engineering (MEC ENG),102A,Introduction to Mechanical Systems for Mechatronics,"E 10, E 28, ENG R1A, MEC ENG C85 or CIV ENG C30, EE 40 or EE 100",4,nan,"The objectives of this course are to introduce students to modern experimental techniques for mechanical engineering, and to improve students' written and oral communication skills. Students will be provided exposure to, and experience with, a variety of sensors used in mechatronic systems including sensors to measure temperature, displacement, velocity, acceleration and strain. The role of error and uncertainty in measurements and analysis will be examined. Students will also be provided exposure to, and experience with, using commercial software for data acquisition and analysis. The role and limitations of spectral analysis of digital data will be discussed.",Engineering
Nuclear Engineering (NUC ENG),130,Analytical Methods for Non-proliferation,NUC ENG 101,4,nan,"Use of nuclear measurement techniques to detect clandestine movement and/or possession of nuclear materials by third parties. Nuclear detection, forensics, signatures, and active and passive interrogation methodologies will be explored. Techniques currently deployed for arms control and treaty verification will be discussed. Emphasis will be placed on common elements of detection technology from the viewpoint of resolution of threat signatures from false positives due to naturally occurring radioactive material. Laboratory will involve experiments conducted in the Nucleonics Laboratory featuring passive and active neutron signals, gamma ray detection, fission neutron multiplicity, and U and Pu isotopic identification and age determination. Students should be familiar with alpha, beta, gamma, and neutron radiation and basic concepts of nuclear fission.",Engineering
Nuclear Engineering (NUC ENG),175,Methods of Risk Analysis,Upper division standing,3,nan,"Methodological approaches for the quantification of technological risk and risk based decision making. Probabilistic safety assessment, human health risks, environmental and ecological risk analysis.",Engineering
Interdisciplinary Studies Field Major (ISF),C145,GIS and Environmental Spatial Data Analysis,None,4,nan,"This course offers an introduction to spatial data analysis. It integrates ArcGIS analysis with spatial statistical analysis for the study of pattern and process applicable to a wide variety of fields. Major topics covered include: spatial sampling, processing data with ARC Info, exploratory GIS analysis, spatial decomposition, spatial point patterns and Ripley's K function, spatial autocorrelation, geostatistics, spatially weighted regression, spatial autoregression, generalized linear models and generalized linear mixed models. accompany the formation of multicultural Europe. This involves (1) an examination of the traditional concepts of nationhood and citizenship, and (2)a study of the Europeanization of culture. Also listed as History C176 and Geography C152.",Environmental Science
African American Studies (AFRICAM),101,Research Methods for African American Studies,STAT 2 or STAT 20,5,nan,"As an introduction to interdisciplinary research methods as they are applied to the study of African American communities, the course will examine theoretical and conceptual issues; techniques for identifying existing research; and sources and methods of social research and data collection. The main focus will be on qualitative methods.",Humanities
American Studies (AMERSTD),C134,Information Technology and Society,None,4,nan,"This course assesses the role of information technology in the digitalization of society by focusing on the deployment of e-government, e-commerce, e-learning, the digital city, telecommuting, virtual communities, internet time, the virtual office, and the geography of cyber space. The course will also discuss the role of information technology in the governance and economic development of society.",Humanities
Asian American Studies Program (ASAMST),165,Research Methodologies in Asian American Communities,ASAMST 20A or 20B,4,nan,"Approaches to research in the Asian American community with emphasis on the San Francisco Bay Area. Problems of research design, measurement, and data collection, processing ,and analysis will be considered.",Humanities
History (HIST),88,How Does History Count?,DATA 8,2,nan,"We will explore how historical data becomes historical evidence and how recent technological advances affect long-established practices, such as close attention to historical context and contingency. Will the advent of fast computing and big data make history count more or lead to unprecedented insights into the study of change over time? During our weekly discussions, we will apply what we learn in lectures and labs to the analysis of selected historical sources and get an understanding of constructing historical datasets. We will also consider scholarly debates over quantitative evidence and historical argument.",Humanities
Mass Communications (MASSCOM),130,Research Methods in Media Studies,MASSCOM 10,4,nan,"This course is intended to familiarize students with some of the primary research methods used to study mass media texts and audiences (and the relationship between the two). Because the field of media studies has historical roots in both the social sciences and humanities, the course will cover both quantitative and qualitative approaches to communications research. Course readings will describe research methods, offer examples of research projects and findings, and present critiques of research studies and methods. ",Humanities
Media Studies (MEDIAST),130,Research Methods in Media Studies,MASSCOM 10,4,nan,"This course is intended to familiarize students with some of the primary research methods used to study mass media texts and audiences (and the relationship between the two). Because the field of media studies has historical roots in both the social sciences and humanities, the course will cover both quantitative and qualitative approaches to communications research. Course readings will describe research methods, offer examples of research projects and findings, and present critiques of research studies and methods. Course assignments will involve designing and conducting a series of sample projects on a single topic of the student's choosing in order to gain a fuller understanding of various research methods and their limitations and strengths. There are five separate research projects on the syllabus; students must complete the first project and may conduct any three of the remaining four projects. Students must present and discuss their research findings for one project to the class.",Humanities
Middle Eastern Studies (M E STU),102,Scope and Methods of Research in Middle Eastern Studies,Upper division standing,4,nan,"Required for all students majoring in Middle Eastern Studies, open to all students in International and Area Studies Teaching Program focusing on the Middle East interdisciplinary research strategies for the collection, interpretation, and analysis of data. Course integrates the study of the fundamental theories of social science, with the practical techniques of social science research methods.",Humanities
Native American Studies (NATAMST),110,Theories and Methods in Native American Studies,NATAMST 71,4,nan,"Overview of literary theory and criticism, historiography, and social sciences theories and methods useful in the study of Native American literature, history and contemporary tribal groups. Course will develop skills of information gathering and development of theories that structure information.",Humanities
Philosophy (PHILOS),100,Philosophical Methods,"PHILOS 2, 4, 25A, 25B.",4,nan,"The course is designed to acquaint students with the techniques of philosophical reasoning through detailed study of selected philosophical texts and through extensive training in philosophical writing, based on those texts.",Humanities
Philosophy (PHILOS),141,Philosophy and Game Theory,One course in philosophy.,4,nan,"The course builds an understanding, demonstrates engineering uses, and provides hand-on experience for object-oriented programming as well as exposes a practical knowledge of advanced features available in MATLAB. The course will begin with a brief review of basic MATLAB features and quickly move to class organization and functionality. The introduced concepts are reinforced by examining the advanced graphical features of MATLAB. The material will also include the effective use of programs written in C and FORTRAN, and will cover SIMULINK, a MATLAB toolbox providing for an effective ways of model simulations. Throughout the course, the emphasis will be placed on examples and homework assignments from engineering disciplines.",Humanities
Mathematics (MATH),191,Experimental Courses in Mathematics,Consent of instructor,1,nan,The topics to be covered and the method of instruction to be used will be announced at the beginning of each semester that such courses are offered.,Mathematics/Statistics
Mathematics (MATH),54,Linear Algebra and Differential Equations,MATH 1B,4,nan,Basic linear algebra; matrix arithmetic and determinants. Vector spaces; inner product as spaces. Eigenvalues and eigenvectors; linear transformations. Homogeneous ordinary differential equations; first-order differential equations with constant coefficients. Fourier series and partial differential equations.,Mathematics/Statistics
Mathematics (MATH),170,Mathematical Methods for Optimization,"MATH 53, MATH 54",4,MATLAB,"The modeling, analysis, and optimization of complex systems requires a range of algorithms and design software. This course reviews the fundamental techniques underlying the design methodology for complex systems, using integrated circuit design as example. Topics include design flows, discrete and continuous models and algorithms, and strategies for implementing algorithms efficiently and correctly in software. Laboratory assignments and a class project will expose students to state-of-the-art tools.",Mathematics/Statistics
Mathematics (MATH),128A,Numerical Analysis,"MATH 53, MATH 54",4,nan,"Programming for numerical calculations, round-off error, approximation and interpolation, numerical quadrature, and solution of ordinary differential equations. Practice on the computer.",Mathematics/Statistics
Public Health (PB HLTH),145,Statistical Analysis of Continuous Outcome Data,PB HLTH 142,4,nan,"Regression models for continuous outcome data: least squares estimates and their properties, interpreting coefficients, prediction, comparing models, checking model assumptions, transformations, outliers, and influential points. Categorical explanatory variables: interaction and analysis of covariance, correlation and partial correlation. Appropriate graphical methods and statistical computing. Analysis of variance for one- and two-factor models: F tests, assumption checking, multiple comparisons. Random effects models and variance components. Introduction to repeated measures models.",Mathematics/Statistics
Statistics (STAT),133,Concepts of Computing with Data,None,3,R,"An introduction to computationally intensive applied statistics. Topics will include organization and use of databases, visualization and graphics, statistical learning and data mining, model validation procedures, and the presentation of results.",Mathematics/Statistics
Statistics (STAT),134,Concepts of Probability,"MATH 1A, MATH 1B",4,nan,"An introduction to probability, emphasizing concepts and applications. Conditional expectation, independence, laws of large numbers. Discrete and continuous random variables. Central limit theorem. Selected topics such as the Poisson process, Markov chains, characteristic functions.",Mathematics/Statistics
Statistics (STAT),135,Concepts of Statistics,"STAT 134, MATH 54, STAT 133",4,nan,"A comprehensive survey course in statistical theory and methodology. Topics include descriptive statistics, maximum likelihood estimation, non-parametric methods, introduction to optimality, goodness-of-fit tests, analysis of variance, bootstrap and computer-intensive methods and least squares estimation. The laboratory includes computer-based data-analytic applications to science and engineering.",Mathematics/Statistics
Statistics (STAT),89A,Introduction to Matrices and Graphs in Data Science,DATA 8,2,nan,"This connector will cover introductory topics in the mathematics of data science, focusing on discrete probability and linear algebra and the connections between them that are useful in modern theory and practice. We will focus on matrices and graphs as popular mathematical structures with which to model data. For examples, as models for term-document corpora, high-dimensional regression problems, ranking/classification of web data, adjacency properties of social network data, etc.",Mathematics/Statistics
Statistics (STAT),131A,Introduction to Probability and Statistics for Life Scientists,MATH 1A or MATH 16A,4,nan,"Ideas for estimation and hypothesis testing basic to applications, including an introduction to probability. Linear estimation and normal regression theory.",Mathematics/Statistics
Statistics (STAT),151A,Linear Modeling: Theory and Applications,"STAT 102 or STAT 135, STAT 133",4,nan,"A coordinated treatment of linear and generalized linear models and their application. Linear regression, analysis of variance and covariance, random effects, design and analysis of experiments, quality improvement, log-linear models for discrete multivariate data, model selection, robustness, graphical techniques, productive use of computers, in-depth case studies.",Mathematics/Statistics
Statistics (STAT),154,Modern Statistical Prediction and Machine Learning,"MATH 53, MATH  54, STAT 135, MATH 55 ",4,R or Python,"Theory and practice of statistical prediction. Contemporary methods as extensions of classical methods. Topics: optimal prediction rules, the curse of dimensionality, empirical risk, linear regression and classification, basis expansions, regularization, splines, the bootstrap, model selection, classification and regression trees, boosting, support vector machines. Computational efficiency versus predictive performance. Emphasis on experience with real data and assessing statistical assumptions.",Mathematics/Statistics
Statistics (STAT),88,Probability and Mathematical Statistics in Data Science,DATA 8,2,nan,"In this connector course we will state precisely and prove results discovered in DS8 through working with data. Topics include: total variation distance between discrete distributions; the mean, standard deviation, and tail bounds; correlation, and the derivation of the regression equation; probabilities, random variables, and the Central Limit Theorem; probabilistic models; symmetries in random permutations; prior and posterior distributions, and Bayes rule.",Mathematics/Statistics
Statistics (STAT),159,Reproducible and Collaborative Data Science,"STAT 133, STAT 134, STAT 135",4,"Bash, Git, Python, and LaTeX","A project-based introduction to statistical data analysis. Through case studies, computer laboratories, and a term project, students will learn practical techniques and tools for producing statistically sound and appropriate, reproducible, and verifiable computational answers to scientific questions. Course emphasizes version control, testing, process automation, code review, and collaborative programming. Software tools may include Bash, Git, Python, and LaTeX.",Mathematics/Statistics
Statistics (STAT),152,Sampling Surveys,"STAT 101 or STAT 134, STAT 133, STAT 135",4,nan,"Theory and practice of sampling from finite populations. Simple random, stratified, cluster, and double sampling. Sampling with unequal probabilities. Properties of various estimators including ratio, regression, and difference estimators. Error estimation for complex samples.",Mathematics/Statistics
